{
  "schema_version": "1.0",
  "support_matrix_id": "csm-run-valid-001",
  "plugin_version": "1.1.1",
  "workflow_run_id": "run-valid-001",
  "rows": [
    {
      "claim_id": "CL-001",
      "source_id": "S-001",
      "evidence_span_ref": "S-001-span-001",
      "support_verdict": "supports",
      "scope_match": {
        "species": "match",
        "cell_type": "match",
        "assay": "match",
        "endpoint": "match"
      },
      "overclaim_risk": "low",
      "allowed_in_final": true,
      "allowed_final_wording": "Synthetic public fixture supports a conservative audit claim.",
      "review_surface": "citation-verifier",
      "independent_review_required": true,
      "limitations": "synthetic fixture for validator behavior only"
    }
  ]
}
